{
  "site": "railway",
  "url": "https://railway.com",
  "archetypes": [
    "developer-tool-modern",
    "motion-driven-showcase"
  ],
  "summary": "Railway sells cloud infrastructure through a calm, dark, product-led homepage that pairs emotional positioning with concrete operational UI proof.",
  "layout": {
    "container_strategy": "Wide centered sections with a narrow hero copy column and large overlapping product panels.",
    "grid_style": "Mostly single-column bands that alternate copy blocks with screenshot-led demos.",
    "section_spacing": "Generous vertical spacing with tall feature bands and clear visual resets.",
    "density": "Moderate overall, with dense detail contained inside product screenshots.",
    "alignment": "Centered hero, then mostly left-aligned content within structured panels.",
    "responsive_notes": "Mobile preserves order and spacing but stacks feature content into a simple vertical flow."
  },
  "typography": {
    "style": "High-contrast serif hero paired with restrained sans-serif UI and body text.",
    "hero_scale": "Large display headline sized for immediate emotional impact.",
    "body_scale": "Standard SaaS body size with short supporting paragraphs.",
    "line_length": "Controlled and readable, especially in hero and feature copy.",
    "hierarchy_strategy": "Expressive headline followed by compact benefit sections and product labels."
  },
  "color_surface": {
    "palette": "Near-black, navy, muted violet, and soft off-white text.",
    "background_strategy": "Illustrated dark hero atmosphere with section-level color shifts.",
    "surface_strategy": "Dark product panels with thin borders, subtle shadows, and muted separators.",
    "contrast_style": "High text contrast overall, with lower-contrast secondary metadata inside screenshots.",
    "special_effects": [
      "illustrated sky background",
      "accent glows",
      "live-metric style counters"
    ]
  },
  "components": {
    "nav": "Top nav with dropdown triggers, direct links, and a persistent demo CTA.",
    "buttons": "Rounded solid primary buttons and subdued outlined secondary buttons.",
    "cards": "Dark quote cards and structured product service cards inside screenshot shells.",
    "feature_sections": "Benefit-led sections paired with architecture, networking, scaling, logging, or workflow visuals.",
    "forms": "No major form interaction on the captured homepage.",
    "footer": "Dense multi-column footer extended by promo links, comparisons, and status/legal items."
  },
  "copy": {
    "tone": "Calm, confident, developer-aware, and lightly aspirational.",
    "headline_style": "Short emotional promise followed by plain-language benefit framing.",
    "cta_style": "Action-led and simple, centered on deploy, demo, and learn-more actions.",
    "proof_style": "Operational screenshots, customer quotes, developer testimonials, and large usage counters."
  },
  "motion": {
    "overall_style": "Likely restrained product-state motion rather than theatrical brand animation.",
    "hover_style": "Not confirmed from the available evidence.",
    "scroll_style": "Likely section reveals and tab transitions, but manual confirmation is missing.",
    "transition_intensity": "Moderate.",
    "timing_guess": "Probably quick UI-style easing in the 150ms to 300ms range for tabs and hovers.",
    "notable_patterns": [
      "tabbed product phases",
      "animated-looking counters",
      "large app-shell demos"
    ]
  },
  "technical_signals": {
    "webgl_or_3d": "No direct WebGL or 3D evidence in the capture.",
    "animation_stack_guess": [
      "unknown"
    ],
    "rendering_notes": "Presentation appears driven by layered artwork, standard images, and client-side UI state rather than advanced rendering.",
    "performance_notes": "Large screenshots and atmospheric hero art may be the main cost; avoid overshipping oversized media on mobile."
  },
  "observed": [
    {
      "category": "layout",
      "statement": "The hero centers a narrow copy block above a large dark product canvas that overlaps the illustrated background.",
      "confidence": "high"
    },
    {
      "category": "color_surface",
      "statement": "The page uses a near-black and navy palette with purple as the dominant interactive accent.",
      "confidence": "high"
    },
    {
      "category": "components",
      "statement": "Feature storytelling repeatedly relies on architecture, metrics, logs, and settings screenshots instead of abstract icon cards.",
      "confidence": "high"
    },
    {
      "category": "copy",
      "statement": "Headlines are benefit-led and low-jargon, emphasizing reduced complexity and operational calm.",
      "confidence": "high"
    },
    {
      "category": "motion",
      "statement": "A visible tablist for Deploy, Network, Scale, Monitor, and Evolve indicates interactive state switching in the core product story.",
      "confidence": "medium"
    }
  ],
  "inferred": [
    {
      "category": "motion",
      "statement": "The marketing site likely favors lightweight tab and reveal transitions over heavy cinematic animation.",
      "confidence": "medium"
    },
    {
      "category": "technical_signals",
      "statement": "The illustrated hero background is likely a static or layered visual asset rather than realtime rendering.",
      "confidence": "medium"
    },
    {
      "category": "components",
      "statement": "The homepage seems built from a small reusable set of dark product-shell components that can be re-skinned for different product stories.",
      "confidence": "medium"
    }
  ],
  "uncertain": [
    {
      "category": "technical_signals",
      "statement": "The exact frontend framework and animation stack for the marketing site are not confirmed by the available evidence.",
      "confidence": "low"
    },
    {
      "category": "motion",
      "statement": "Hover styling, reduced-motion handling, and sticky-header behavior were not manually tested.",
      "confidence": "low"
    }
  ],
  "reusable_rules": [
    "Use one emotionally resonant headline above product-native proof.",
    "Pair each core product claim with a concrete operational visual.",
    "Keep feature copy short and hand off detail to small learn-more links.",
    "Use one accent color consistently across CTAs, active states, and product highlights.",
    "Separate branded atmosphere from product clarity with expressive backgrounds and restrained UI shells.",
    "Show believable logs, services, metrics, or architecture views when marketing technical software."
  ],
  "implementation_notes": [
    "Build the hero as a centered copy stack with layered background artwork and an overlapping screenshot frame.",
    "Implement the phase switcher with accessible tabs controlling static product panels or lightweight transitions.",
    "Use reusable dark app-shell wrappers so multiple sections can share one product visual language.",
    "Check thin borders, dim metadata, and status colors for dark-theme accessibility.",
    "Optimize screenshot and artwork payloads aggressively for mobile."
  ],
  "caveats": [
    "The purple-on-dark treatment is easy to imitate badly and can feel generic without a stronger brand rationale.",
    "Illustrated atmospherics should match the product story; otherwise they become decorative noise.",
    "Dense product screenshots should not be copied directly if the new product lacks comparable UI depth.",
    "Fake-live metrics or logs can reduce credibility if they do not feel grounded in a real workflow."
  ],
  "scores": {
    "visual_polish": 5,
    "clarity": 4,
    "hierarchy": 4,
    "copy_quality": 4,
    "motion_quality": 4,
    "component_quality": 5,
    "technical_ambition": 4,
    "pattern_reusability": 5
  }
}
