{
  "site": "posthog",
  "url": "https://posthog.com",
  "archetypes": [
    "developer-tool-modern",
    "brand-storytelling"
  ],
  "summary": "PostHog turns its homepage into a faux desktop workspace that mixes product exploration, anti-corporate humor, and dense interactive modules to speak directly to technical buyers.",
  "layout": {
    "container_strategy": "Application-shell layout with nested window chrome, side launchers, and embedded content panels.",
    "grid_style": "Loose panel composition inside a faux desktop rather than a classic marketing grid.",
    "section_spacing": "Compact and dense on desktop, then vertically stacked on mobile.",
    "density": "High, intentionally so.",
    "alignment": "Mostly left-aligned inside panels with consistent shell framing.",
    "responsive_notes": "Mobile preserves the sequence and personality but collapses the faux desktop into stacked modules."
  },
  "typography": {
    "style": "Functional sans-serif with editor-like labels, bold headings, and lots of utility text.",
    "hero_scale": "Moderate headline scale inside a larger interface frame.",
    "body_scale": "Small to medium body text, often in longer paragraphs than typical SaaS pages.",
    "line_length": "Varied, with some long explanatory sections.",
    "hierarchy_strategy": "Shell chrome and panel grouping carry as much hierarchy as text scale."
  },
  "color_surface": {
    "palette": "Warm beige, cream, black, white, and strong orange CTA accents.",
    "background_strategy": "Muted desktop background with white and cream window surfaces.",
    "surface_strategy": "Border-heavy panels, notification cards, and faux editor chrome.",
    "contrast_style": "High contrast for actions and headings, moderate contrast for utility labels.",
    "special_effects": [
      "faux operating-system shell",
      "floating notifications",
      "e-commerce parody CTA"
    ]
  },
  "components": {
    "nav": "Menubar-style primary navigation with a persistent free CTA and utility icons.",
    "buttons": "Orange rounded CTAs supported by small utility buttons and shell controls.",
    "cards": "Notification cards, customer cards, README-style content panels, and faux product windows.",
    "feature_sections": "Stage selector, app tabs, pricing table, handbook/proof blocks, and playful CTA modules.",
    "forms": "No traditional lead form; interactions center on buttons, radios, tabs, and question actions.",
    "footer": "Lightweight legal/status links with less emphasis than the main shell content."
  },
  "copy": {
    "tone": "Technical, transparent, sarcastic, and self-aware.",
    "headline_style": "Plainspoken and utility-led, often supported by jokes or anti-corporate framing.",
    "cta_style": "Direct signup and install actions with supporting human-help links.",
    "proof_style": "Customer logos, pricing detail, handbook links, docs, and explicit product breadth."
  },
  "motion": {
    "overall_style": "Stateful and UI-like, centered on control changes, panel updates, and floating notices.",
    "hover_style": "Not confirmed from the available evidence.",
    "scroll_style": "Likely more about stacked module progression than large reveal choreography.",
    "transition_intensity": "Moderate.",
    "timing_guess": "Probably fast interface-style transitions around 100ms to 250ms.",
    "notable_patterns": [
      "stage radios",
      "product tabs",
      "floating notification cards",
      "mode-switch shell controls"
    ]
  },
  "technical_signals": {
    "webgl_or_3d": "No direct WebGL or 3D evidence in the capture.",
    "animation_stack_guess": [
      "unknown client-side interactive stack"
    ],
    "rendering_notes": "The page appears heavily client-driven, with many small interactive controls and custom shell behaviors, but no advanced rendering cues.",
    "performance_notes": "Dense client-side UI can become interaction-heavy; keep shell chrome and notification systems lightweight on mobile."
  },
  "observed": [
    {
      "category": "layout",
      "statement": "The homepage is framed as a faux desktop or editor workspace rather than a standard hero-plus-sections marketing page.",
      "confidence": "high"
    },
    {
      "category": "components",
      "statement": "The page contains menubars, side-launcher icons, stage radios, app tabs, floating notices, and multiple shell controls.",
      "confidence": "high"
    },
    {
      "category": "copy",
      "statement": "Copy uses technical transparency and humor, explicitly rejecting traditional sales patterns.",
      "confidence": "high"
    },
    {
      "category": "technical_signals",
      "statement": "Script references include PostHog-owned assets for product tours, conversations, logs, surveys, and recorder functionality.",
      "confidence": "high"
    },
    {
      "category": "layout",
      "statement": "Mobile preserves the same brand artifacts and sequence while collapsing the shell into stacked modules.",
      "confidence": "high"
    }
  ],
  "inferred": [
    {
      "category": "technical_signals",
      "statement": "The site likely uses a component-rich client-side architecture to coordinate many small state changes across the faux desktop.",
      "confidence": "medium"
    },
    {
      "category": "motion",
      "statement": "Most motion is probably subtle and interface-like rather than cinematic, emphasizing swaps, toggles, and hover emphasis.",
      "confidence": "medium"
    },
    {
      "category": "copy",
      "statement": "The intentionally busy visual style is calibrated for a technical audience that tolerates exploration and density.",
      "confidence": "medium"
    }
  ],
  "uncertain": [
    {
      "category": "technical_signals",
      "statement": "The exact frontend framework and motion library are not confirmed by the capture.",
      "confidence": "low"
    },
    {
      "category": "accessibility",
      "statement": "Keyboard, screen-reader, and focus behavior across the faux desktop controls were not manually verified.",
      "confidence": "low"
    }
  ],
  "reusable_rules": [
    "Use a strong interface metaphor only when it reinforces the product story throughout the page.",
    "Let brand voice shape both layout and copy decisions.",
    "Make playful sections still perform a real product job such as pricing explanation or trust building.",
    "Reserve dense interactive modules for audiences willing to explore.",
    "Keep primary CTAs obvious even inside eccentric chrome.",
    "Balance unusual presentation with concrete proof such as pricing, docs, logos, and handbook links."
  ],
  "implementation_notes": [
    "Model the page as an application shell with reusable window, menu, notification, and panel primitives.",
    "Use disciplined local state or state machines for tabs, radios, floating cards, and shell toggles.",
    "Preserve one consistent border language and CTA accent so the novelty stays legible.",
    "Audit focus order, ARIA labels, and keyboard support aggressively in dense faux-OS layouts.",
    "Strip nonessential chrome on smaller screens before sacrificing readability."
  ],
  "caveats": [
    "This style becomes clutter very quickly if the component grammar is not extremely disciplined.",
    "Faux desktop metaphors can hurt accessibility if semantics are weak.",
    "Humor that is not tied to brand or product relevance will age badly.",
    "The density may alienate less technical buyers even if the target audience loves it."
  ],
  "scores": {
    "visual_polish": 4,
    "clarity": 3,
    "hierarchy": 4,
    "copy_quality": 5,
    "motion_quality": 4,
    "component_quality": 5,
    "technical_ambition": 5,
    "pattern_reusability": 4
  }
}
