{
  "site": "airbnb",
  "url": "https://www.airbnb.com",
  "archetypes": [
    "marketplace-utility",
    "product-system-ui"
  ],
  "summary": "The captured Airbnb homepage centers search and browsing through a rounded, task-first interface that uses clear category switching, bright card surfaces, and strong utility framing instead of marketing spectacle.",
  "layout": {
    "container_strategy": "Clean top shell centered around a large segmented search bar, followed by light discovery and footer areas.",
    "grid_style": "Desktop uses simple lists and columns; mobile uses card-based browsing rows.",
    "section_spacing": "Generous spacing around the search shell and category areas, with compact footer columns.",
    "density": "Low to moderate, optimized for scanning.",
    "alignment": "Strong horizontal alignment in the search shell and left-aligned content below.",
    "responsive_notes": "Mobile behaves more like an app browse feed, with listing cards and overlays appearing quickly."
  },
  "typography": {
    "style": "Neutral, legible sans-serif with medium-to-bold headings and clean listing metadata.",
    "hero_scale": "No oversized marketing hero; emphasis comes from the search shell and section headings.",
    "body_scale": "Readable UI and metadata scale tuned for scanning.",
    "line_length": "Short across labels and utility copy.",
    "hierarchy_strategy": "Task UI first, then section labels, then card metadata."
  },
  "color_surface": {
    "palette": "White, light gray, black, and Airbnb pink-red accents.",
    "background_strategy": "Bright neutral backgrounds with soft shadows and occasional light-gray section areas.",
    "surface_strategy": "Rounded pills, cards, and overlays with soft elevation.",
    "contrast_style": "High text contrast with accent color reserved for brand and primary actions.",
    "special_effects": [
      "rounded segmented search shell",
      "icon-led category tabs",
      "soft floating overlays"
    ]
  },
  "components": {
    "nav": "Category-led top navigation with icon tabs, profile controls, and host/language actions.",
    "buttons": "Rounded icon and text buttons with a bold circular search action.",
    "cards": "Listing cards with large imagery, save affordances, title, price, and rating metadata.",
    "feature_sections": "Search shell, discovery tabs, listing feeds, and structured support/footer navigation.",
    "forms": "Core interaction centers on a segmented search interface rather than a classic form layout.",
    "footer": "Large structured utility footer split into support, hosting, company, legal, language, and currency controls."
  },
  "copy": {
    "tone": "Utility-led, concise, and trust-oriented.",
    "headline_style": "Functional section labels instead of aspirational marketing headlines.",
    "cta_style": "Action-oriented search and browsing labels such as start, add dates, add guests, and show more.",
    "proof_style": "Trust is implied through support, policy, and product-system maturity rather than long-form persuasion."
  },
  "motion": {
    "overall_style": "Likely product-interaction motion centered on search, tabs, drawers, and modals.",
    "hover_style": "Not confirmed from the available evidence.",
    "scroll_style": "Likely sticky or app-like in places, but the capture does not confirm exact behavior.",
    "transition_intensity": "Moderate.",
    "timing_guess": "Probably polished app-style transitions around 150ms to 300ms.",
    "notable_patterns": [
      "segmented search interactions",
      "category tab switching",
      "mobile promotional modal",
      "listing card actions"
    ]
  },
  "technical_signals": {
    "webgl_or_3d": "No direct WebGL or 3D evidence in the capture.",
    "animation_stack_guess": [
      "Airbnb bundled frontend stack",
      "unknown motion library"
    ],
    "rendering_notes": "The capture shows Airbnb-owned bundled assets and a product-grade interactive shell, with no advanced rendering cues.",
    "performance_notes": "Search and browse responsiveness matter more than decorative effects; keep overlays, imagery, and any video payloads tightly controlled."
  },
  "observed": [
    {
      "category": "layout",
      "statement": "The homepage is organized around a large rounded segmented search bar with where, when, and who segments.",
      "confidence": "high"
    },
    {
      "category": "components",
      "statement": "The top navigation uses icon-led category tabs for Homes, Experiences, and Services, while mobile also shows listing cards and promotional overlays.",
      "confidence": "high"
    },
    {
      "category": "color_surface",
      "statement": "The interface relies on bright neutral surfaces and Airbnb pink-red accents, with rounded corners as a dominant visual motif.",
      "confidence": "high"
    },
    {
      "category": "copy",
      "statement": "Copy is functional and action-oriented, focusing on search inputs, browsing labels, and support/trust language.",
      "confidence": "high"
    },
    {
      "category": "technical_signals",
      "statement": "DOM notes report video elements and Airbnb-owned bundled frontend assets, though their exact on-page role is not obvious from the screenshots.",
      "confidence": "medium"
    }
  ],
  "inferred": [
    {
      "category": "layout",
      "statement": "The homepage likely varies by platform or personalization state, which may explain the differences between captured desktop and mobile views.",
      "confidence": "medium"
    },
    {
      "category": "motion",
      "statement": "Search expansion, date picking, and guest selection probably drive most of the meaningful motion instead of decorative animation.",
      "confidence": "medium"
    },
    {
      "category": "components",
      "statement": "The design system appears optimized for app-web continuity, treating the homepage more like a product surface than a marketing landing page.",
      "confidence": "medium"
    }
  ],
  "uncertain": [
    {
      "category": "layout",
      "statement": "The lower portion of the desktop homepage is not fully evidenced because the desktop full-page screenshot is blank.",
      "confidence": "low"
    },
    {
      "category": "motion",
      "statement": "Search expansion details, sticky behavior, hover treatments, and the role of the detected video elements were not confirmed by manual probing.",
      "confidence": "low"
    }
  ],
  "reusable_rules": [
    "Put the main user task at the center of the homepage.",
    "Use one dominant composite component to organize the top-of-page experience.",
    "Make category switching visually obvious through icons, labels, and active-state contrast.",
    "Keep browse-heavy surfaces bright, roomy, and easy to scan.",
    "Use rounded corners consistently so the interface feels friendly and unified.",
    "Move trust, support, and policy complexity into structured utility areas instead of cluttering the top shell."
  ],
  "implementation_notes": [
    "Implement search as a segmented composite control with independent interactive regions and a shared outer shell.",
    "Use stable card primitives for media, save affordances, titles, pricing, and rating metadata.",
    "Prioritize dismissible overlays and large touch targets on mobile.",
    "Optimize for fast search and browse interactions before adding decorative media.",
    "Treat footer information architecture as a product problem, not an afterthought."
  ],
  "caveats": [
    "Rounded white marketplace shells become generic if the information architecture is weak.",
    "Search-first pages fail if interaction details are poor, even when the visuals look polished.",
    "Mobile promotional overlays can easily become intrusive.",
    "Partial desktop capture means some conclusions should remain conservative."
  ],
  "scores": {
    "visual_polish": 4,
    "clarity": 5,
    "hierarchy": 4,
    "copy_quality": 4,
    "motion_quality": 4,
    "component_quality": 5,
    "technical_ambition": 4,
    "pattern_reusability": 5
  }
}
